{
  "success": true,
  "message": "Retrieved user preference profile 'USR001'",
  "data": {
    "userId": "USR001",
    "name": "Aarav Sharma",
    "gender": "men",
    "ageGroup": "adult",
    "preferredCategories": ["tshirt", "jeans", "jacket"],
    "preferredColors": ["Black", "Blue", "Navy"],
    "preferredStyles": ["casual", "streetwear"],
    "preferredFit": "regular",
    "preferredBrands": ["Urban Wear", "Denim Co"],
    "preferredMaterials": ["100% Premium Cotton"],
    "preferredOccasions": ["Daily Wear"],
    "preferredSeasons": ["all-season", "summer"],
    "budgetRange": { "min": 500.0, "max": 3000.0 },
    "budgetTier": "medium",
    "favoriteSizes": ["M", "L"],
    "height": 178.0,
    "weight": 72.0,
    "bodyType": "regular",
    "wishlist": ["TS001", "JN001"],
    "purchaseHistory": ["TS001"],
    "recommendationHistory": ["TS001"],
    "location": { "country": "India", "state": "Karnataka", "city": "Bengaluru" },
    "climate": "coastal",
    "favoriteColorsFrequency": { "black": 18, "blue": 12 },
    "interactionMetrics": { "productsViewed": 125, "productsLiked": 42, "productsPurchased": 9 },
    "lastPreferenceUpdate": "2026-01-25T14:30:00Z",
    "createdAt": "2026-01-10T08:00:00Z",
    "updatedAt": "2026-01-25T14:30:00Z"
  },
  "timestamp": "2026-07-31T23:00:00Z",
  "requestId": "b2c3d4e5-f6a7-8b9c-0d1e-2f3a4b5c6d7e"
}
